{
  "deployment_identity": "dedicated-no-secret-probe-boundary-v10.1",
  "format_version": "1.1",
  "identity_kind": "AZPR_V10_1_PROBE_SERVICE_IDENTITY",
  "launcher_identity_sha256": "cccccccccccccccccccccccccccccccccccccccccccccccccccccccccccccccc",
  "runtime_configuration_sha256": "dddddddddddddddddddddddddddddddddddddddddddddddddddddddddddddddd",
  "service_binary_sha256": "306c6ca7407560340797866e077e053627ad409277d1b9da58106fce4cf717cb",
  "service_id": "probe-service-v10-1-0001"
}
